share_package/data/Bhome2024/DE_v10/json_v9/DE_Bhome2024_by_gemini_202510281202.json

{
  "study_identification": {
    "study_id": "null",
    "reference_file_names": "null",
    "author_journal_year": "null",
    "title": "null",
    "doi": "null"
  },
  "study_characteristics": {
    "study_objective": "null",
    "study_design": "null",
    "study_design_other": "null"
  },
  "reference_cohort_and_imaging": {
    "dataset_name": {
      "answer": "",
      "confidence_rating": "",
      "negative_answer_category": "",
      "reason": "",
      "supporting_text": "",
      "location": ""
    },
    "hc_n": {
      "answer": "",
      "confidence_rating": "",
      "negative_answer_category": "",
      "reason": "",
      "supporting_text": "",
      "location": ""
    },
    "hc_age": {
      "answer": "",
      "confidence_rating": "",
      "negative_answer_category": "",
      "reason": "",
      "supporting_text": "",
      "location": ""
    },
    "hc_sex": {
      "answer": "",
      "confidence_rating": "",
      "negative_answer_category": "",
      "reason": "",
      "supporting_text": "",
      "location": ""
    },
    "imaging_modality": {
      "answer": "",
      "confidence_rating": "",
      "negative_answer_category": "",
      "reason": "",
      "supporting_text": "",
      "location": ""
    },
    "analysis_level": {
      "answer": "",
      "confidence_rating": "",
      "negative_answer_category": "",
      "reason": "",
      "supporting_text": "",
      "location": ""
    },
    "preprocessing_pipeline": {
      "answer": "",
      "confidence_rating": "",
      "negative_answer_category": "",
      "reason": "",
      "supporting_text": "",
      "location": ""
    },
    "quality_checking": {
      "answer": "",
      "confidence_rating": "",
      "negative_answer_category": "",
      "reason": "",
      "supporting_text": "",
      "location": ""
    },
    "quality_checking_detail": {
      "answer": "",
      "confidence_rating": "",
      "negative_answer_category": "",
      "reason": "",
      "supporting_text": "",
      "location": ""
    },
    "site_effect_handling": {
      "answer": "",
      "confidence_rating": "",
      "negative_answer_category": "",
      "reason": "",
      "supporting_text": "",
      "location": ""
    },
    "site_effect_handling_detail": {
      "answer": "",
      "confidence_rating": "",
      "negative_answer_category": "",
      "reason": "",
      "supporting_text": "",
      "location": ""
    }
  },
  "normative_modeling": {
    "model_origin": {
      "answer": "",
      "confidence_rating": "",
      "negative_answer_category": "",
      "reason": "",
      "supporting_text": "",
      "location": ""
    },
    "model_origin_detail": {
      "answer": "",
      "confidence_rating": "",
      "negative_answer_category": "",
      "reason": "",
      "supporting_text": "",
      "location": ""
    },
    "modeling_method": {
      "answer": "",
      "confidence_rating": "",
      "negative_answer_category": "",
      "reason": "",
      "supporting_text": "",
      "location": ""
    },
    "software_tool": {
      "answer": "",
      "confidence_rating": "",
      "negative_answer_category": "",
      "reason": "",
      "supporting_text": "",
      "location": ""
    },
    "response_variable": {
      "answer": "",
      "confidence_rating": "",
      "negative_answer_category": "",
      "reason": "",
      "supporting_text": "",
      "location": ""
    },
    "predictor_variables": {
      "answer": "",
      "confidence_rating": "",
      "negative_answer_category": "",
      "reason": "",
      "supporting_text": "",
      "location": ""
    },
    "predictor_effects": {
      "answer": "",
      "confidence_rating": "",
      "negative_answer_category": "",
      "reason": "",
      "supporting_text": "",
      "location": ""
    },
    "nm_vldtn_handle_ns": {
      "answer": "",
      "confidence_rating": "",
      "negative_answer_category": "",
      "reason": "",
      "supporting_text": "",
      "location": ""
    },
    "nm_vldtn_same_domain_nonindep": {
      "answer": "",
      "confidence_rating": "",
      "negative_answer_category": "",
      "reason": "",
      "supporting_text": "",
      "location": ""
    },
    "nm_vldtn_same_domain_indep": {
      "answer": "",
      "confidence_rating": "",
      "negative_answer_category": "",
      "reason": "",
      "supporting_text": "",
      "location": ""
    },
    "nm_vldtn_diff_domain": {
      "answer": "",
      "confidence_rating": "",
      "negative_answer_category": "",
      "reason": "",
      "supporting_text": "",
      "location": ""
    }
  },
  "clinical_application_and_analysis": {
    "clinical_dataset": {
      "answer": "",
      "confidence_rating": "",
      "negative_answer_category": "",
      "reason": "",
      "supporting_text": "",
      "location": ""
    },
    "diseases_studied": {
      "answer": "",
      "confidence_rating": "",
      "negative_answer_category": "",
      "reason": "",
      "supporting_text": "",
      "location": ""
    },
    "clinical_groups_n": {
      "answer": "",
      "confidence_rating": "",
      "negative_answer_category": "",
      "reason": "",
      "supporting_text": "",
      "location": ""
    },
    "clinical_groups_age": {
      "answer": "",
      "confidence_rating": "",
      "negative_answer_category": "",
      "reason": "",
      "supporting_text": "",
      "location": ""
    },
    "clinical_groups_sex": {
      "answer": "",
      "confidence_rating": "",
      "negative_answer_category": "",
      "reason": "",
      "supporting_text": "",
      "location": ""
    },
    "deviation_metric": {
      "answer": "",
      "confidence_rating": "",
      "negative_answer_category": "",
      "reason": "",
      "supporting_text": "",
      "location": ""
    },
    "association_analysis": "null",
    "key_findings_brief": "null",
    "key_findings_detailed": "null",
    "key_limitations": "null",
    "application_notes": "null"
  },
  "general_notes": {
    "general_notes": "-\n\n\nNONCANONICAL_DATA:\n- study_id: \"Bhome2024\"\n- reference_file_names: \"Bhome2024.pdf.md; 1-s2.0-S2213158224000354-mmc1.md\"\n- author_journal_year: \"Bhome et al., NeuroImage: Clinical, 2024\"\n- title: \"A neuroimaging measure to capture heterogeneous patterns of atrophy in Parkinson's disease and dementia with Lewy bodies\"\n- doi: \"10.1016/j.nicl.2024.103596\"\n- study_objective: \"To quantify patterns of neurodegenerative dissimilarity in participants with PD and DLB and evaluate the potential clinical relevance of total outlier count by testing its association with key clinical measures in PD and DLB.\"\n- study_design: \"Cross-sectional\"\n- study_design_other: \"-\"\n- dataset_name: \"UCL/NACC\"\n- hc_n: \"165\"\n- hc_age: \"UCL controls: 50-80; NACC controls: no information\"\n- hc_sex: \"no information\"\n- imaging_modality: \"T1-weighted MRI\"\n- analysis_level: \"ROI-level\"\n- preprocessing_pipeline: \"FreeSurfer v6.0.0\"\n- quality_checking: \"Yes\"\n- quality_checking_detail: \"Processed images were quality controlled by visually inspecting grey and white matter boundaries, and subcortical segmentation boundaries superimposed on the corresponding structural T1-weighted image by a researcher blind to clinical status. Particular attention was paid to atrophied scans which can sometimes affect robust segmentation of brain structures.\"\n- site_effect_handling: \"Model-based\"\n- site_effect_handling_detail: \"The reference normative model was recalibrated to the study datasets with an adapted transfer learning approach (Kia et al., 2022). This involved inputting control data from our two study sites into the reference normative model to generate stable parameters for cortical thicknesses and subcortical volumes, to account for residual differences in data distributions, caused by factors such as scanner differences.\"\n- model_origin: \"Pre-trained\"\n- model_origin_detail: \"Rutherford and colleagues (Rutherford et al., 2022) modelled normative lifespan curves for cortical thicknesses across 148 regions (Destrieux parcellation) and subcortical volumes derived from Freesurfer using a warped Bayesian Linear Regression with age and sex as covariates, and accounting for site differences (Bayer et al., 2022). Their reference cohort comprised 58,836 participants from 82 sites.\"\n- modeling_method: \"wBLR\"\n- software_tool: \"PCNToolkit (v0.20)\"\n- response_variable: \"Cortical thickness; Subcortical volumes\"\n- predictor_variables: \"Age; Sex\"\n- predictor_effects: \"Age and sex are covariates.\"\n- nm_vldtn_handle_ns: {\"Answer\": \"Yes\", \"Confidence Rating\": \"High\", \"Negative Answer Category\": \"Not Negative\", \"Reason\": \"The study used a pre-trained model that accounted for site differences. The model was then recalibrated using control data from the two study sites to account for residual differences.\", \"Supporting Text\": \"Rutherford and colleagues (Rutherford et al., 2022) modelled normative lifespan curves for cortical thicknesses across 148 regions (Destrieux parcellation) and subcortical volumes derived from Freesurfer using a warped Bayesian Linear Regression with age and sex as covariates, and accounting for site differences (Bayer et al., 2022). ... The reference normative model was recalibrated to the study datasets with an adapted transfer learning approach (Kia et al., 2022). This involved inputting control data from our two study sites into the reference normative model to generate stable parameters for cortical thicknesses and subcortical volumes, to account for residual differences in data distributions, caused by factors such as scanner differences.\", \"Location\": \"Bhome2024.pdf.md, Section 2.4 and 2.5\"}\n- nm_vldtn_.same_domain_nonindep: {\"Answer\": \"No\", \"Confidence Rating\": \"High\", \"Negative Answer Category\": \"Missing\", \"Reason\": \"The paper does not mention any validation using non-independent data within the same domain.\", \"Supporting Text\": \"-\", \"Location\": \"-\"}\n- nm_vldtn_same_domain_indep: {\"Answer\": \"No\", \"Confidence Rating\": \"High\", \"Negative Answer Category\": \"Missing\", \"Reason\": \"The paper does not mention any validation using independent data within the same domain.\", \"Supporting Text\": \"-\", \"Location\": \"-\"}\n- nm_vldtn_diff_domain: {\"Answer\": \"No\", \"Confidence Rating\": \"High\", \"Negative Answer Category\": \"Missing\", \"Reason\": \"The paper does not mention any validation using data from a different domain.\", \"Supporting Text\": \"-\", \"Location\": \"-\"}\n- clinical_dataset: \"UCL/NACC\"\n- diseases_studied: \"Parkinson's disease (PD); Dementia with Lewy bodies (DLB)\"\n- clinical_groups_n: \"PD: 108; DLB: 61\"\n- clinical_groups_age: \"PD: 64.1 (7.8); DLB: 73.8 (6.5)\"\n- clinical_groups_sex: \"PD: M 51 (48%); DLB: M 55 (90%)\"\n- deviation_metric: \"Z-score; Total outlier count\"\n- association_analysis: \"Linear regressions adjusting for age and sex were used to test associations between total outlier count and composite cognitive score, MoCA and visuo-perception, measured using the Hooper Visual Organisation Test. In exploratory analyses, we tested associations with disease-specific measures including global measure of severity (MDSUPDRS), motor severity (MDS-UPDRS-III), hallucination severity (UMPDHQ) and depression score (HADS).\"\n- key_findings_brief: \"Neuroanatomical normative modelling shows promise as a clinically informative technique in PD and DLB, where patterns of atrophy are variable.\"\n- key_findings_detailed: \"There was significantly greater inter-individual dissimilarity in brain-outlier patterns in PD poor compared to high visual performers (W = 522.5; p < 0.01) and in DLB compared to PD (W = 5649; p < 0.01). PD poor visual performers had significantly greater total outlier counts compared to high (β = -4.73 (SE = 1.30); t = -3.64; p < 0.01) whereas a conventional group-level GLM failed to identify differences. Higher total outlier counts were associated with poorer MoCA (β = -0.55 (SE = 0.27), t = -2.04, p = 0.05) and composite cognitive scores (β = -2.01 (SE = 0.79); t = -2.54; p = 0.02) in DLB, and visuoperception (β = -0.67 (SE = 0.19); t = -3.59; p < 0.01), in PD.\"\n- key_limitations: \"Outliers were defined as z-scores < -1.96. This means total outliner count may fail to capture potentially relevant subthreshold levels of neurodegeneration. Differences between sites from which DLB participant data were collected. DLB dataset is relatively small.\"\n- application_notes: \"-\""
  }
}

share_package/ai_workspace/20251221155403/study_1/Bhome2024.pdf.md

## A B S T R A C T

Results: There  was  significantly  greater  inter-individual  dissimilarity  in  brain-outlier  patterns  in  PD  poor compared to high visual performers (W = 522.5; p &lt; 0.01) and in DLB compared to PD (W = 5649; p &lt; 0.01). PD poor visual performers had significantly greater total outlier counts compared to high ( β = -4.73 (SE = 1.30); t = -3.64; p &lt; 0.01) whereas a conventional group-level GLM failed to identify differences. Higher total outlier counts were associated with poorer MoCA ( β = -0.55 (SE = 0.27), t = -2.04, p = 0.05) and composite cognitive scores ( β = -2.01 (SE = 0.79); t = -2.54; p = 0.02) in DLB, and visuoperception ( β = -0.67 (SE = 0.19); t = -3.59; p &lt; 0.01), in PD.

## 3.4. Total outlier counts are associated with cognitive performance in DLB and with visuospatial processing in PD

In  DLB,  there  were  significant  associations  between  total  outlier count and both the composite cognitive score ( β = -2.01 (SE = 0.79); t = -2.54; p = 0.02) and MoCA ( β = -0.55 (SE = 0.27), t = -2.04, p = 0.05), when adjusting for age and sex. There was no significant association with the Hooper Visual Organisation Test ( β = -0.45 (SE = 0.24); t = -1.89; p = 0.068, Fig. 3 ) . There were also no significant associations with the MDS-UPDRS, MDS-UPDRS-III, UM-PDHQ or HADS (Table 2).

In the PD group, total outlier score showed a significant association with the Hooper Visual Organisation Test ( β = -0.67 (SE = 0.19); t = -3.59; p &lt; 0.01), but did not show associations with global cognitive performance. Similar to DLB, no associations were found in PD between total outlier count and other disease measures (Table 2).